id|name|images|tags|active|quantity|category|meta-title|eya-category|商品编号：|价格：|品牌：|重量：|评价：|购买数量：|商品总价：|na|产地：|促销价:|剩余时间：|desc|
13291|长生果红玫瑰烤花生|http://www.chishenghuo.com/eimages/images/201411/source_img/1097_G_1415129532888.jpg|长生果红玫瑰烤花生`坚果类`花生`瓜子`休闲`膨化`薯片`休闲零食|1|100|甜点零食`吃货世界|长生果红玫瑰烤花生|当前位置: 首页 > 休闲零食 > 休闲 膨化 薯片 > 坚果类 花生 瓜子 > 长生果红玫瑰烤花生|maya-YL-3921|2.99|长生果|250| (已有0人评论)|减少数量 增加数量||na|中华|||<p style="text-align: center"><img src="http://www.chishenghuo.com/eimages/bdimages/upload1/20141105/1415129498167679.jpg" title="长生果红玫瑰烤花生.jpg"></p><p><br></p>|
13294|长生果黑金刚烤花生|http://www.chishenghuo.com/eimages/images/201411/source_img/1098_G_1415129727213.jpg|长生果黑金刚烤花生`坚果类`花生`瓜子`休闲`膨化`薯片`休闲零食|1|100|甜点零食`吃货世界|长生果黑金刚烤花生|当前位置: 首页 > 休闲零食 > 休闲 膨化 薯片 > 坚果类 花生 瓜子 > 长生果黑金刚烤花生|maya-YL-3914|2.99|长生果|250| (已有0人评论)|减少数量 增加数量||na|中华|||<p style="text-align: center"><img src="http://www.chishenghuo.com/eimages/bdimages/upload1/20141105/1415129718859314.jpg" title="长生果黑金刚烤花生.jpg"></p><p><br></p>|
13297|庄园 东北有机酸白菜丝 火锅必备|http://www.chishenghuo.com/eimages/images/201411/source_img/1099_G_1415130568977.jpg|庄园`东北有机酸白菜丝`火锅必备`火锅`锅底`蘸料`海味`调味`养生`休闲零食|1|100|调料汤底`吃货世界|庄园 东北有机酸白菜丝 火锅必备|当前位置: 首页 > 休闲零食 > 海味 调味 养生 > 火锅 锅底 蘸料 > 庄园 东北有机酸白菜丝 火锅必备|maya-YL-1967|2.99|庄园|454| (已有0人评论)|减少数量 增加数量||na|中华|||<p style="text-align: center"><img src="http://www.chishenghuo.com/eimages/images/image/65541415130559.jpg" title="庄园 东北有机酸白菜丝1.jpg"></p><p><br></p><p><br></p><p style="margin-top: 0px; margin-bottom: 0px; padding: 0px; color: rgb(102, 102, 102); font-family: 微软雅黑, Verdana, 宋体; font-size: 12px; line-height: 18px; white-space: normal; text-align: left; background-color: rgb(255, 255, 255);"><span style="font-size: 16px;">酸菜汆白肉</span></p><p style="margin-top: 0px; margin-bottom: 0px; padding: 0px; color: rgb(102, 102, 102); font-family: 微软雅黑, Verdana, 宋体; font-size: 12px; line-height: 18px; white-space: normal; text-align: left; background-color: rgb(255, 255, 255);"><span style="font-size: 16px;">&nbsp;</span></p><p style="margin-top: 0px; margin-bottom: 0px; padding: 0px; color: rgb(102, 102, 102); font-family: 微软雅黑, Verdana, 宋体; font-size: 12px; line-height: 18px; white-space: normal; text-align: left; background-color: rgb(255, 255, 255);"><span style="font-size: 16px;">&nbsp;</span></p><p style="margin-top: 0px; margin-bottom: 0px; padding: 0px; color: rgb(102, 102, 102); font-family: 微软雅黑, Verdana, 宋体; font-size: 12px; line-height: 18px; white-space: normal; text-align: left; background-color: rgb(255, 255, 255);"><span style="font-size: 16px;">材料<br>骨头汤半锅，五花肉半斤，酸菜1颗，海米1小把，葱3节，姜5片，花椒20粒，八角2粒，草果1颗</span></p><p style="margin-top: 0px; margin-bottom: 0px; padding: 0px; color: rgb(102, 102, 102); font-family: 微软雅黑, Verdana, 宋体; font-size: 12px; line-height: 18px; white-space: normal; text-align: left; background-color: rgb(255, 255, 255);"><span style="font-size: 16px;">&nbsp;</span></p><p style="margin-top: 0px; margin-bottom: 0px; padding: 0px; color: rgb(102, 102, 102); font-family: 微软雅黑, Verdana, 宋体; font-size: 12px; line-height: 18px; white-space: normal; text-align: left; background-color: rgb(255, 255, 255);"><span style="font-size: 16px;">做法</span></p><p style="margin-top: 0px; margin-bottom: 0px; padding: 0px; color: rgb(102, 102, 102); font-family: 微软雅黑, Verdana, 宋体; font-size: 12px; line-height: 18px; white-space: normal; text-align: left; background-color: rgb(255, 255, 255);"><br><span style="font-size: 16px;">1.五花肉洗净后，加入冷水锅中，煮出血沫后捞出。</span></p><p style="margin-top: 0px; margin-bottom: 0px; padding: 0px; color: rgb(102, 102, 102); font-family: 微软雅黑, Verdana, 宋体; font-size: 12px; line-height: 18px; white-space: normal; text-align: left; background-color: rgb(255, 255, 255);"><br><span style="font-size: 16px;">2.另备一锅装冷水至一半，将五花肉放入中火煮半小时至刚熟，捞出控干水份，等凉后放 冰箱冷藏 1小时至肉质收紧。切成薄片备用。</span></p><p style="margin-top: 0px; margin-bottom: 0px; padding: 0px; color: rgb(102, 102, 102); font-family: 微软雅黑, Verdana, 宋体; font-size: 12px; line-height: 18px; white-space: normal; text-align: left; background-color: rgb(255, 255, 255);"><br><span style="font-size: 16px;">3.酸菜用流水冲洗两三遍，攥去水份。将每张酸菜叶子片成两层或三层，再切成细细丝， 这样炖出来的汤更有味儿。</span></p><p style="margin-top: 0px; margin-bottom: 0px; padding: 0px; color: rgb(102, 102, 102); font-family: 微软雅黑, Verdana, 宋体; font-size: 12px; line-height: 18px; white-space: normal; text-align: left; background-color: rgb(255, 255, 255);"><br><span style="font-size: 16px;">4.葱、姜、花椒、八角、草果集中在作料袋里，放在骨头汤里煮开。</span></p><p style="margin-top: 0px; margin-bottom: 0px; padding: 0px; color: rgb(102, 102, 102); font-family: 微软雅黑, Verdana, 宋体; font-size: 12px; line-height: 18px; white-space: normal; text-align: left; background-color: rgb(255, 255, 255);"><br><span style="font-size: 16px;">5.将酸菜丝、海米放入汤里小火炖半小时左右，再放入薄五花肉片<br>煮20分钟，加盐调味 即可。</span></p><p style="margin-top: 0px; margin-bottom: 0px; padding: 0px; color: rgb(102, 102, 102); font-family: 微软雅黑, Verdana, 宋体; font-size: 12px; line-height: 18px; white-space: normal; text-align: left; background-color: rgb(255, 255, 255);"><span style="font-size: 16px;">&nbsp;</span></p><p style="margin-top: 0px; margin-bottom: 0px; padding: 0px; color: rgb(102, 102, 102); font-family: 微软雅黑, Verdana, 宋体; font-size: 12px; line-height: 18px; white-space: normal; text-align: left; background-color: rgb(255, 255, 255);"><span style="font-size: 16px;">&nbsp;</span></p><p style="margin-top: 0px; margin-bottom: 0px; padding: 0px; color: rgb(102, 102, 102); font-family: 微软雅黑, Verdana, 宋体; font-size: 12px; line-height: 18px; white-space: normal; text-align: left; background-color: rgb(255, 255, 255);"><span style="font-size: 16px;">&nbsp;</span></p><p style="margin-top: 0px; margin-bottom: 0px; padding: 0px; color: rgb(102, 102, 102); font-family: 微软雅黑, Verdana, 宋体; font-size: 12px; line-height: 18px; white-space: normal; text-align: left; background-color: rgb(255, 255, 255);"><span style="font-size: 16px;">&nbsp;</span></p><p style="margin-top: 0px; margin-bottom: 0px; padding: 0px; color: rgb(102, 102, 102); font-family: 微软雅黑, Verdana, 宋体; font-size: 12px; line-height: 18px; white-space: normal; text-align: left; background-color: rgb(255, 255, 255);"><span style="font-size: 16px;">&nbsp;</span></p><p style="margin-top: 0px; margin-bottom: 0px; padding: 0px; color: rgb(102, 102, 102); font-family: 微软雅黑, Verdana, 宋体; font-size: 12px; line-height: 18px; white-space: normal; text-align: left; background-color: rgb(255, 255, 255);"><span style="font-size: 16px;">小诀窍</span></p><p style="margin-top: 0px; margin-bottom: 0px; padding: 0px; color: rgb(102, 102, 102); font-family: 微软雅黑, Verdana, 宋体; font-size: 12px; line-height: 18px; white-space: normal; text-align: left; background-color: rgb(255, 255, 255);"><br><span style="font-size: 16px;">1、五花肉要事先煮好凉透才能切得又薄又整齐。</span></p><p style="margin-top: 0px; margin-bottom: 0px; padding: 0px; color: rgb(102, 102, 102); font-family: 微软雅黑, Verdana, 宋体; font-size: 12px; line-height: 18px; white-space: normal; text-align: left; background-color: rgb(255, 255, 255);"><br><span style="font-size: 16px;">2、酸菜不切成细细丝，汤就不够浓厚。</span></p><p style="margin-top: 0px; margin-bottom: 0px; padding: 0px; color: rgb(102, 102, 102); font-family: 微软雅黑, Verdana, 宋体; font-size: 12px; line-height: 18px; white-space: normal; text-align: left; background-color: rgb(255, 255, 255);"><br><span style="font-size: 16px;">3、一定要放海米才能吊出鲜味。花椒也是提味的，不可少。</span></p><p style="margin-top: 0px; margin-bottom: 0px; padding: 0px; color: rgb(102, 102, 102); font-family: 微软雅黑, Verdana, 宋体; font-size: 12px; line-height: 18px; white-space: normal; text-align: left; background-color: rgb(255, 255, 255);"><br><span style="font-size: 16px;">4、骨头汤的做法：，买根光滑不带肉的棒肉，让商家事先给劈好，先放冷水里煮去血沫，再放另备好一半冷水的砂锅里，加入两滴醋使骨头里的钙质能更好的溶解，微火炖两小时至白色即可。</span></p><p><br></p>|
13300|台湾合时牌酸豇豆|http://www.chishenghuo.com/eimages/images/201411/source_img/1100_G_1415130929961.jpg|台湾合时牌酸豇豆`五谷杂粮`干货`汤包`海味`调味`养生`休闲零食|1|100|酱菜干货`吃货世界|台湾合时牌酸豇豆|当前位置: 首页 > 休闲零食 > 海味 调味 养生 > 五谷杂粮 干货 汤包 > 台湾合时牌酸豇豆|maya-YL-0927|3.49|合时牌|300| (已有0人评论)|减少数量 增加数量||na|中华|||<p style="text-align: center"><img src="http://www.chishenghuo.com/eimages/images/image/8961415130888.jpg" title="肉末香菇酸豇豆.jpg"></p><p><br></p><p><br></p><h1 class="center" property="v:name" style="margin: 0px 0px 5px; padding: 0px; border: 0px; font-size: 22px; font-family: Tahoma, Helvetica, Arial, 宋体, sans-serif; vertical-align: baseline; color: rgb(17, 17, 17); line-height: 28px; text-align: center; white-space: normal; background-color: rgb(255, 255, 255);">肉末香菇酸豇豆</h1><p><br></p><p><br></p><h2 class="no-bottom" style="margin: 0px; padding: 0px; border-width: 0px; border-bottom-style: solid; border-bottom-color: white; font-size: 16px; font-family: Tahoma, Helvetica, Arial, 宋体, sans-serif; vertical-align: baseline; color: rgb(254, 86, 12); line-height: 20px; white-space: normal; background-color: rgb(255, 255, 255);">材料</h2><p style="margin-top: 0px; padding: 0px; border: 0px; font-size: 14px; font-family: Tahoma, Helvetica, Arial, 宋体, sans-serif; vertical-align: baseline; color: rgb(34, 34, 34); line-height: 24px; white-space: normal; background-color: rgb(255, 255, 255);"><br></p><p style="margin-top: 0px; padding: 0px; border: 0px; font-size: 14px; font-family: Tahoma, Helvetica, Arial, 宋体, sans-serif; vertical-align: baseline; color: rgb(34, 34, 34); line-height: 24px; white-space: normal; background-color: rgb(255, 255, 255);">原料：<span class="ingredient" style="margin: 0px; padding: 0px; border: 0px; font-weight: inherit; font-style: inherit; vertical-align: baseline; color: rgb(34, 34, 34);"><span class="name" style="margin: 0px; padding: 0px; border: 0px; font-weight: inherit; font-style: inherit; vertical-align: baseline;">酸豇豆</span></span>、<span class="ingredient" style="margin: 0px; padding: 0px; border: 0px; font-weight: inherit; font-style: inherit; vertical-align: baseline; color: rgb(34, 34, 34);"><span class="name" style="margin: 0px; padding: 0px; border: 0px; font-weight: inherit; font-style: inherit; vertical-align: baseline;">猪肉馅</span></span>、<span class="ingredient" style="margin: 0px; padding: 0px; border: 0px; font-weight: inherit; font-style: inherit; vertical-align: baseline; color: rgb(34, 34, 34);"><span class="name" style="margin: 0px; padding: 0px; border: 0px; font-weight: inherit; font-style: inherit; vertical-align: baseline;">香菇</span></span>&nbsp;<br><br></p><p style="margin-top: 0px; padding: 0px; border: 0px; font-size: 14px; font-family: Tahoma, Helvetica, Arial, 宋体, sans-serif; vertical-align: baseline; color: rgb(34, 34, 34); line-height: 24px; white-space: normal; background-color: rgb(255, 255, 255);">调料：<span class="ingredient" style="margin: 0px; padding: 0px; border: 0px; font-weight: inherit; font-style: inherit; vertical-align: baseline; color: rgb(34, 34, 34);"><span class="name" style="margin: 0px; padding: 0px; border: 0px; font-weight: inherit; font-style: inherit; vertical-align: baseline;">小辣椒</span></span>、<span class="ingredient" style="margin: 0px; padding: 0px; border: 0px; font-weight: inherit; font-style: inherit; vertical-align: baseline; color: rgb(34, 34, 34);"><span class="name" style="margin: 0px; padding: 0px; border: 0px; font-weight: inherit; font-style: inherit; vertical-align: baseline;">花椒</span></span>、<span class="ingredient" style="margin: 0px; padding: 0px; border: 0px; font-weight: inherit; font-style: inherit; vertical-align: baseline; color: rgb(34, 34, 34);"><span class="name" style="margin: 0px; padding: 0px; border: 0px; font-weight: inherit; font-style: inherit; vertical-align: baseline;">葱姜蒜</span></span>、<span class="ingredient" style="margin: 0px; padding: 0px; border: 0px; font-weight: inherit; font-style: inherit; vertical-align: baseline; color: rgb(34, 34, 34);"><span class="name" style="margin: 0px; padding: 0px; border: 0px; font-weight: inherit; font-style: inherit; vertical-align: baseline;">料酒</span></span>、盐、糖、<span class="ingredient" style="margin: 0px; padding: 0px; border: 0px; font-weight: inherit; font-style: inherit; vertical-align: baseline; color: rgb(34, 34, 34);"><span class="name" style="margin: 0px; padding: 0px; border: 0px; font-weight: inherit; font-style: inherit; vertical-align: baseline;">鸡精</span></span>、<span class="ingredient" style="margin: 0px; padding: 0px; border: 0px; font-weight: inherit; font-style: inherit; vertical-align: baseline; color: rgb(34, 34, 34);"><span class="name" style="margin: 0px; padding: 0px; border: 0px; font-weight: inherit; font-style: inherit; vertical-align: baseline;">胡椒粉</span></span><br></p><h2 class="no-bottom" style="margin: 0px; padding: 0px; border-width: 0px; border-bottom-style: solid; border-bottom-color: white; font-size: 16px; font-family: Tahoma, Helvetica, Arial, 宋体, sans-serif; vertical-align: baseline; color: rgb(254, 86, 12); line-height: 20px; white-space: normal; background-color: rgb(255, 255, 255);"><br></h2><h2 class="no-bottom" style="margin: 0px; padding: 0px; border-width: 0px; border-bottom-style: solid; border-bottom-color: white; font-size: 16px; font-family: Tahoma, Helvetica, Arial, 宋体, sans-serif; vertical-align: baseline; color: rgb(254, 86, 12); line-height: 20px; white-space: normal; background-color: rgb(255, 255, 255);"><br></h2><h2 class="no-bottom" style="margin: 0px; padding: 0px; border-width: 0px; border-bottom-style: solid; border-bottom-color: white; font-size: 16px; font-family: Tahoma, Helvetica, Arial, 宋体, sans-serif; vertical-align: baseline; color: rgb(254, 86, 12); line-height: 20px; white-space: normal; background-color: rgb(255, 255, 255);"><br></h2><h2 class="no-bottom" style="margin: 0px; padding: 0px; border-width: 0px; border-bottom-style: solid; border-bottom-color: white; font-size: 16px; font-family: Tahoma, Helvetica, Arial, 宋体, sans-serif; vertical-align: baseline; color: rgb(254, 86, 12); line-height: 20px; white-space: normal; background-color: rgb(255, 255, 255);"><br></h2><h2 class="no-bottom" style="margin: 0px; padding: 0px; border-width: 0px; border-bottom-style: solid; border-bottom-color: white; font-size: 16px; font-family: Tahoma, Helvetica, Arial, 宋体, sans-serif; vertical-align: baseline; color: rgb(254, 86, 12); line-height: 20px; white-space: normal; background-color: rgb(255, 255, 255);">做法</h2><p><span style="color: rgb(34, 34, 34); font-family: Tahoma, Helvetica, Arial, 宋体, sans-serif; font-size: 14px; line-height: 25.2000007629395px; background-color: rgb(255, 255, 255);"><br></span></p><p><span style="color: rgb(34, 34, 34); font-family: Tahoma, Helvetica, Arial, 宋体, sans-serif; font-size: 14px; line-height: 25.2000007629395px; background-color: rgb(255, 255, 255);">1、酸豆角也要洗净稍微泡泡要不太咸了，然后切碎。&nbsp;</span><br style="color: rgb(34, 34, 34); font-family: Tahoma, Helvetica, Arial, 宋体, sans-serif; font-size: 14px; line-height: 25.2000007629395px; white-space: normal; background-color: rgb(255, 255, 255);"><span style="color: rgb(34, 34, 34); font-family: Tahoma, Helvetica, Arial, 宋体, sans-serif; font-size: 14px; line-height: 25.2000007629395px; background-color: rgb(255, 255, 255);">2、准备好肉末、小辣椒切圈、花椒和葱姜蒜切末。&nbsp;</span><br style="color: rgb(34, 34, 34); font-family: Tahoma, Helvetica, Arial, 宋体, sans-serif; font-size: 14px; line-height: 25.2000007629395px; white-space: normal; background-color: rgb(255, 255, 255);"><span style="color: rgb(34, 34, 34); font-family: Tahoma, Helvetica, Arial, 宋体, sans-serif; font-size: 14px; line-height: 25.2000007629395px; background-color: rgb(255, 255, 255);">3、锅中倒入少许油，油热后先煸炒辣椒、花椒，然后炒香葱姜蒜，再下肉末炒，来点料酒烹出香味。&nbsp;</span><br style="color: rgb(34, 34, 34); font-family: Tahoma, Helvetica, Arial, 宋体, sans-serif; font-size: 14px; line-height: 25.2000007629395px; white-space: normal; background-color: rgb(255, 255, 255);"><span style="color: rgb(34, 34, 34); font-family: Tahoma, Helvetica, Arial, 宋体, sans-serif; font-size: 14px; line-height: 25.2000007629395px; background-color: rgb(255, 255, 255);">4、肉末炒熟后，将酸豇豆下锅翻炒两分钟。&nbsp;</span><br style="color: rgb(34, 34, 34); font-family: Tahoma, Helvetica, Arial, 宋体, sans-serif; font-size: 14px; line-height: 25.2000007629395px; white-space: normal; background-color: rgb(255, 255, 255);"><span style="color: rgb(34, 34, 34); font-family: Tahoma, Helvetica, Arial, 宋体, sans-serif; font-size: 14px; line-height: 25.2000007629395px; background-color: rgb(255, 255, 255);">5、酸豆角发干，加入香菇继续煸炒然后加一点水盖盖改小火炒熟。&nbsp;</span><br style="color: rgb(34, 34, 34); font-family: Tahoma, Helvetica, Arial, 宋体, sans-serif; font-size: 14px; line-height: 25.2000007629395px; white-space: normal; background-color: rgb(255, 255, 255);"><span style="color: rgb(34, 34, 34); font-family: Tahoma, Helvetica, Arial, 宋体, sans-serif; font-size: 14px; line-height: 25.2000007629395px; background-color: rgb(255, 255, 255);">6、加少许酱油、糖、鸡精、胡椒粉，撒香葱末出锅。</span></p><p><br></p>|
13303|日本本洲味付海苔片辣味 100袋入|http://www.chishenghuo.com/eimages/images/201411/source_img/1101_G_1415136432675.jpg|日本本洲味付海苔片辣味`100袋入`薯片`虾条`干吃面`休闲`膨化`薯片`休闲零食|1|100|甜点零食`吃货世界|日本本洲味付海苔片辣味 100袋入|当前位置: 首页 > 休闲零食 > 休闲 膨化 薯片 > 薯片 虾条 干吃面 > 日本本洲味付海苔片辣味 100袋入|maya-YL-0064|5.49|本洲|90| (已有0人评论)|减少数量 增加数量||na|日本|||<p style="text-align: center"><img src="http://www.chishenghuo.com/eimages/bdimages/upload1/20141105/1415136418248381.jpg" style="" title="日本本洲味付海苔片辣味 100袋入2.jpg"></p><p style="text-align: center"><img src="http://www.chishenghuo.com/eimages/bdimages/upload1/20141105/1415136419479027.jpg" style="" title="日本本洲味付海苔片辣味 100袋入1.jpg"></p><p><br></p>|
13309|银丰牌 美味榨菜粒|http://www.chishenghuo.com/eimages/images/201411/source_img/1103_G_1415137666958.jpg|银丰牌`美味榨菜粒`拌饭`罐头`蛋类`方便`速食`饮料`休闲零食|1|100|方便零食`吃货世界|银丰牌 美味榨菜粒|当前位置: 首页 > 休闲零食 > 方便 速食 饮料 > 拌饭 罐头 蛋类 > 银丰牌 美味榨菜粒|maya-YL-01000|0.59|银丰牌|70| (已有0人评论)|减少数量 增加数量||na|中华|||<p style="text-align: center"><img src="http://www.chishenghuo.com/eimages/bdimages/upload1/20141105/1415137611128079.jpg" title="银丰牌 美味榨菜粒.jpg"></p><p><br></p>|
