id|name|images|tags|active|quantity|category|meta-title|eya-category|商品编号：|价格：|品牌：|重量：|评价：|购买数量：|商品总价：|na|产地：|促销价:|剩余时间：|desc|
13798|韩国DONGWON即食粗纤维松子仁粥|http://www.chishenghuo.com/eimages/images/201411/source_img/1266_G_1416005783628.jpg|韩国DONGWON即食粗纤维松子仁粥`方便面`手擀面`港式炒面`方便`速食`饮料`休闲零食|1|100|方便零食`吃货世界|韩国DONGWON即食粗纤维松子仁粥|当前位置: 首页 > 休闲零食 > 方便 速食 饮料 > 方便面 手擀面 港式炒面 > 韩国DONGWON即食粗纤维松子仁粥|maya-WA-1554|4.15|DONGWON同源东远|285| (已有0人评论)|减少数量 增加数量||na|韩国|||<p><span style="margin: 0px; padding: 0px; color: rgb(102, 102, 102); font-family: 微软雅黑; font-size: large; line-height: 27px; background-color: rgb(255, 255, 255);">⊙[食用方法]：</span><br style="color: rgb(102, 102, 102); white-space: normal; font-family: 微软雅黑; font-size: large; line-height: 27px; background-color: rgb(255, 255, 255);"><span style="margin: 0px; padding: 0px; color: rgb(102, 102, 102); font-family: 微软雅黑; font-size: large; line-height: 27px; background-color: rgb(255, 255, 255);">1.开盖即食</span><br style="color: rgb(102, 102, 102); white-space: normal; font-family: 微软雅黑; font-size: large; line-height: 27px; background-color: rgb(255, 255, 255);"><span style="margin: 0px; padding: 0px; color: rgb(102, 102, 102); font-family: 微软雅黑; font-size: large; line-height: 27px; background-color: rgb(255, 255, 255);">2.如果想吃热的，可以放锅里煮3-4分钟，或是开水中泡7分钟。</span><br style="color: rgb(102, 102, 102); white-space: normal; font-family: 微软雅黑; font-size: large; line-height: 27px; background-color: rgb(255, 255, 255);"><span style="margin: 0px; padding: 0px; color: rgb(102, 102, 102); font-family: 微软雅黑; font-size: large; line-height: 27px; background-color: rgb(255, 255, 255);">3.使用微波炉加热：把里面的盖掀掉，然后把外面的盖盖上。外面的盖上有预留的小孔，加热就可以吃到美美的粥了。微波炉料理时间：700W-1分30秒/1000w-1分10秒。</span></p><p><span style="margin: 0px; padding: 0px; color: rgb(102, 102, 102); font-family: 微软雅黑; font-size: large; line-height: 27px; background-color: rgb(255, 255, 255);"><br></span></p><p><span style="margin: 0px; padding: 0px; color: rgb(102, 102, 102); font-family: 微软雅黑; font-size: large; line-height: 27px; background-color: rgb(255, 255, 255);"></span></p><p style="text-align: center"></p><p style="text-align: center"><img src="http://www.chishenghuo.com/eimages/bdimages/upload1/20141115/1416005874574251.jpg" style="" title="韩国DONGWON即食粗纤维松子仁粥3.jpg"></p><p style="text-align: center"><img src="http://www.chishenghuo.com/eimages/bdimages/upload1/20141115/1416005874788113.jpg" style="" title="韩国DONGWON即食粗纤维松子仁粥2.jpg"></p><p style="text-align: center"><img src="http://www.chishenghuo.com/eimages/bdimages/upload1/20141115/1416005874398308.jpg" style="" title="韩国DONGWON即食粗纤维松子仁粥1.jpg"></p><p style="text-align: center"><img src="http://www.chishenghuo.com/eimages/bdimages/upload1/20141115/1416005770638096.jpg" style="" title="韩国DONGWON即食鲜甜香菇鲍鱼粥3.jpg"></p><p style="text-align: center"><img src="http://www.chishenghuo.com/eimages/bdimages/upload1/20141115/1416005770776335.jpg" style="" title="韩国DONGWON即食鲜甜香菇鲍鱼粥4.jpg"></p><p style="text-align: center"><img src="http://www.chishenghuo.com/eimages/bdimages/upload1/20141115/1416005770559028.jpg" style="" title="韩国DONGWON即食鲜甜香菇鲍鱼粥5.jpg"></p><p style="text-align: center"><img src="http://www.chishenghuo.com/eimages/bdimages/upload1/20141115/1416005770532360.jpg" style="" title="韩国DONGWON即食鲜甜香菇鲍鱼粥6.jpg"></p><p><span style="margin: 0px; padding: 0px; color: rgb(102, 102, 102); font-family: 微软雅黑; font-size: large; line-height: 27px; background-color: rgb(255, 255, 255);"><br></span><br></p>|
13801|韩国DONGWON即食蜂蜜南瓜粥|http://www.chishenghuo.com/eimages/images/201411/source_img/1267_G_1416006220613.jpg|韩国DONGWON即食蜂蜜南瓜粥`方便面`手擀面`港式炒面`方便`速食`饮料`休闲零食|1|100|方便零食`吃货世界|韩国DONGWON即食蜂蜜南瓜粥|当前位置: 首页 > 休闲零食 > 方便 速食 饮料 > 方便面 手擀面 港式炒面 > 韩国DONGWON即食蜂蜜南瓜粥|maya-WA-1592|4.15|DONGWON同源东远|285| (已有0人评论)|减少数量 增加数量||na|韩国|||<p><span style="margin: 0px; padding: 0px; color: rgb(102, 102, 102); font-family: 微软雅黑; font-size: large; line-height: 27px; background-color: rgb(255, 255, 255);">⊙[食用方法]：</span><br style="color: rgb(102, 102, 102); white-space: normal; font-family: 微软雅黑; font-size: large; line-height: 27px; background-color: rgb(255, 255, 255);"><span style="margin: 0px; padding: 0px; color: rgb(102, 102, 102); font-family: 微软雅黑; font-size: large; line-height: 27px; background-color: rgb(255, 255, 255);">1.开盖即食</span><br style="color: rgb(102, 102, 102); white-space: normal; font-family: 微软雅黑; font-size: large; line-height: 27px; background-color: rgb(255, 255, 255);"><span style="margin: 0px; padding: 0px; color: rgb(102, 102, 102); font-family: 微软雅黑; font-size: large; line-height: 27px; background-color: rgb(255, 255, 255);">2.如果想吃热的，可以放锅里煮3-4分钟，或是开水中泡7分钟。</span><br style="color: rgb(102, 102, 102); white-space: normal; font-family: 微软雅黑; font-size: large; line-height: 27px; background-color: rgb(255, 255, 255);"><span style="margin: 0px; padding: 0px; color: rgb(102, 102, 102); font-family: 微软雅黑; font-size: large; line-height: 27px; background-color: rgb(255, 255, 255);">3.使用微波炉加热：把里面的盖掀掉，然后把外面的盖盖上。外面的盖上有预留的小孔，加热就可以吃到美美的粥了。微波炉料理时间：700W-1分30秒/1000w-1分10秒。</span></p><p><span style="margin: 0px; padding: 0px; color: rgb(102, 102, 102); font-family: 微软雅黑; font-size: large; line-height: 27px; background-color: rgb(255, 255, 255);"><br></span></p><p><span style="margin: 0px; padding: 0px; color: rgb(102, 102, 102); font-family: 微软雅黑; font-size: large; line-height: 27px; background-color: rgb(255, 255, 255);"></span></p><p style="text-align: center"><img src="http://www.chishenghuo.com/eimages/bdimages/upload1/20141115/1416006126927266.jpg" style="" title="韩国DONGWON即食蜂蜜南瓜粥3.jpg"></p><p style="text-align: center"><img src="http://www.chishenghuo.com/eimages/bdimages/upload1/20141115/1416006126447716.jpg" style="" title="韩国DONGWON即食蜂蜜南瓜粥2.jpg"></p><p style="text-align: center"><img src="http://www.chishenghuo.com/eimages/bdimages/upload1/20141115/1416006126249884.jpg" style="" title="韩国DONGWON即食蜂蜜南瓜粥1.jpg"></p><p style="text-align: center"><br></p><p style="text-align: center"><br></p><p style="text-align: center"><br></p><p style="text-align: center"><img src="http://www.chishenghuo.com/eimages/bdimages/upload1/20141115/1416006205289941.jpg" style="" title="韩国DONGWON即食鲜甜香菇鲍鱼粥3.jpg"></p><p style="text-align: center"><img src="http://www.chishenghuo.com/eimages/bdimages/upload1/20141115/1416006205161413.jpg" style="" title="韩国DONGWON即食鲜甜香菇鲍鱼粥4.jpg"></p><p style="text-align: center"><img src="http://www.chishenghuo.com/eimages/bdimages/upload1/20141115/1416006205503547.jpg" style="" title="韩国DONGWON即食鲜甜香菇鲍鱼粥5.jpg"></p><p style="text-align: center"><img src="http://www.chishenghuo.com/eimages/bdimages/upload1/20141115/1416006205139226.jpg" style="" title="韩国DONGWON即食鲜甜香菇鲍鱼粥6.jpg"></p><p><span style="margin: 0px; padding: 0px; color: rgb(102, 102, 102); font-family: 微软雅黑; font-size: large; line-height: 27px; background-color: rgb(255, 255, 255);"><br></span><br></p>|
13804|煌上煌 腊鸡腿|http://www.chishenghuo.com/eimages/images/201411/source_img/1268_G_1416253961316.jpg`http://www.chishenghuo.com/eimages/images/201411/goods_img/1268_P_1416253961066.jpg|煌上煌`腊鸡腿`拌饭`罐头`蛋类`方便`速食`饮料`休闲零食|1|100|方便零食`吃货世界|煌上煌 腊鸡腿|当前位置: 首页 > 休闲零食 > 方便 速食 饮料 > 拌饭 罐头 蛋类 > 煌上煌 腊鸡腿|maya-YL1168|9.99|嘉嘉|142| (已有0人评论)|减少数量 增加数量||na|中华|||<p style="text-align: center"><img src="http://www.chishenghuo.com/eimages/images/image/53281416253910.jpg" title="煌上煌 腊鸡腿2.jpg"></p><p><br></p><h1 class="center" property="v:name" style="margin: 0px 0px 5px; padding: 0px; border: 0px; font-size: 22px; font-family: Tahoma, Helvetica, Arial, 宋体, sans-serif; vertical-align: baseline; color: rgb(17, 17, 17); line-height: 28px; text-align: center; white-space: normal; background-color: rgb(255, 255, 255);">腊鸡腿炒饭</h1><p><br></p><h2 class="no-bottom" style="margin: 0px; padding: 0px; border-width: 0px; border-bottom-style: solid; border-bottom-color: white; font-size: 16px; font-family: Tahoma, Helvetica, Arial, 宋体, sans-serif; vertical-align: baseline; color: rgb(254, 86, 12); line-height: 20px; white-space: normal; background-color: rgb(255, 255, 255);">材料</h2><p style="margin-top: 0px; padding: 0px; border: 0px; font-size: 14px; font-family: Tahoma, Helvetica, Arial, 宋体, sans-serif; vertical-align: baseline; color: rgb(34, 34, 34); line-height: 24px; white-space: normal; background-color: rgb(255, 255, 255);"><br></p><p style="margin-top: 0px; padding: 0px; border: 0px; font-size: 14px; font-family: Tahoma, Helvetica, Arial, 宋体, sans-serif; vertical-align: baseline; color: rgb(34, 34, 34); line-height: 24px; white-space: normal; background-color: rgb(255, 255, 255);">材料<span class="ingredient" style="margin: 0px; padding: 0px; border: 0px; font-weight: inherit; font-style: inherit; vertical-align: baseline; color: rgb(34, 34, 34);"><span class="name" style="margin: 0px; padding: 0px; border: 0px; font-weight: inherit; font-style: inherit; vertical-align: baseline;">粳米</span></span><span class="ingredient" style="margin: 0px; padding: 0px; border: 0px; font-weight: inherit; font-style: inherit; vertical-align: baseline; color: rgb(34, 34, 34);"><span class="name" style="margin: 0px; padding: 0px; border: 0px; font-weight: inherit; font-style: inherit; vertical-align: baseline;">饭</span></span>150克，<span class="ingredient" style="margin: 0px; padding: 0px; border: 0px; font-weight: inherit; font-style: inherit; vertical-align: baseline; color: rgb(34, 34, 34);"><span class="name" style="margin: 0px; padding: 0px; border: 0px; font-weight: inherit; font-style: inherit; vertical-align: baseline;">鸡蛋</span></span>1只，<span class="ingredient" style="margin: 0px; padding: 0px; border: 0px; font-weight: inherit; font-style: inherit; vertical-align: baseline; color: rgb(34, 34, 34);"><span class="name" style="margin: 0px; padding: 0px; border: 0px; font-weight: inherit; font-style: inherit; vertical-align: baseline;">葱花</span></span>10克，<span class="ingredient" style="margin: 0px; padding: 0px; border: 0px; font-weight: inherit; font-style: inherit; vertical-align: baseline; color: rgb(34, 34, 34);"><span class="name" style="margin: 0px; padding: 0px; border: 0px; font-weight: inherit; font-style: inherit; vertical-align: baseline;">腊鸡腿</span></span>1只，<span class="ingredient" style="margin: 0px; padding: 0px; border: 0px; font-weight: inherit; font-style: inherit; vertical-align: baseline; color: rgb(34, 34, 34);"><span class="name" style="margin: 0px; padding: 0px; border: 0px; font-weight: inherit; font-style: inherit; vertical-align: baseline;">青豆</span></span>10克调味料<span class="ingredient" style="margin: 0px; padding: 0px; border: 0px; font-weight: inherit; font-style: inherit; vertical-align: baseline; color: rgb(34, 34, 34);"><span class="name" style="margin: 0px; padding: 0px; border: 0px; font-weight: inherit; font-style: inherit; vertical-align: baseline;">味精</span></span>2克，植物油250cc，盐、<span class="ingredient" style="margin: 0px; padding: 0px; border: 0px; font-weight: inherit; font-style: inherit; vertical-align: baseline; color: rgb(34, 34, 34);"><span class="name" style="margin: 0px; padding: 0px; border: 0px; font-weight: inherit; font-style: inherit; vertical-align: baseline;">胡椒粉</span></span>少许<br></p><h2 class="no-bottom" style="margin: 0px; padding: 0px; border-width: 0px; border-bottom-style: solid; border-bottom-color: white; font-size: 16px; font-family: Tahoma, Helvetica, Arial, 宋体, sans-serif; vertical-align: baseline; color: rgb(254, 86, 12); line-height: 20px; white-space: normal; background-color: rgb(255, 255, 255);"><br></h2><h2 class="no-bottom" style="margin: 0px; padding: 0px; border-width: 0px; border-bottom-style: solid; border-bottom-color: white; font-size: 16px; font-family: Tahoma, Helvetica, Arial, 宋体, sans-serif; vertical-align: baseline; color: rgb(254, 86, 12); line-height: 20px; white-space: normal; background-color: rgb(255, 255, 255);"><br></h2><h2 class="no-bottom" style="margin: 0px; padding: 0px; border-width: 0px; border-bottom-style: solid; border-bottom-color: white; font-size: 16px; font-family: Tahoma, Helvetica, Arial, 宋体, sans-serif; vertical-align: baseline; color: rgb(254, 86, 12); line-height: 20px; white-space: normal; background-color: rgb(255, 255, 255);"><br></h2><h2 class="no-bottom" style="margin: 0px; padding: 0px; border-width: 0px; border-bottom-style: solid; border-bottom-color: white; font-size: 16px; font-family: Tahoma, Helvetica, Arial, 宋体, sans-serif; vertical-align: baseline; color: rgb(254, 86, 12); line-height: 20px; white-space: normal; background-color: rgb(255, 255, 255);">做法</h2><p><span style="color: rgb(34, 34, 34); font-family: Tahoma, Helvetica, Arial, 宋体, sans-serif; font-size: 14px; line-height: 25.2000007629395px; background-color: rgb(255, 255, 255);"><br></span></p><p><span style="color: rgb(34, 34, 34); font-family: Tahoma, Helvetica, Arial, 宋体, sans-serif; font-size: 14px; line-height: 25.2000007629395px; background-color: rgb(255, 255, 255);">1、腊鸡腿放入蒸笼蒸约20分钟后取出。</span><br style="color: rgb(34, 34, 34); font-family: Tahoma, Helvetica, Arial, 宋体, sans-serif; font-size: 14px; line-height: 25.2000007629395px; white-space: normal; background-color: rgb(255, 255, 255);"><span style="color: rgb(34, 34, 34); font-family: Tahoma, Helvetica, Arial, 宋体, sans-serif; font-size: 14px; line-height: 25.2000007629395px; background-color: rgb(255, 255, 255);"><br></span></p><p><span style="color: rgb(34, 34, 34); font-family: Tahoma, Helvetica, Arial, 宋体, sans-serif; font-size: 14px; line-height: 25.2000007629395px; background-color: rgb(255, 255, 255);">2、将蒸好的腊鸡腿去骨，切成0.8cm的方丁。</span><br style="color: rgb(34, 34, 34); font-family: Tahoma, Helvetica, Arial, 宋体, sans-serif; font-size: 14px; line-height: 25.2000007629395px; white-space: normal; background-color: rgb(255, 255, 255);"><span style="color: rgb(34, 34, 34); font-family: Tahoma, Helvetica, Arial, 宋体, sans-serif; font-size: 14px; line-height: 25.2000007629395px; background-color: rgb(255, 255, 255);"><br></span></p><p><span style="color: rgb(34, 34, 34); font-family: Tahoma, Helvetica, Arial, 宋体, sans-serif; font-size: 14px; line-height: 25.2000007629395px; background-color: rgb(255, 255, 255);">3、锅内入油烧至四成热后，放入青豆过油至熟沥出。</span><br style="color: rgb(34, 34, 34); font-family: Tahoma, Helvetica, Arial, 宋体, sans-serif; font-size: 14px; line-height: 25.2000007629395px; white-space: normal; background-color: rgb(255, 255, 255);"><span style="color: rgb(34, 34, 34); font-family: Tahoma, Helvetica, Arial, 宋体, sans-serif; font-size: 14px; line-height: 25.2000007629395px; background-color: rgb(255, 255, 255);"><br></span></p><p><span style="color: rgb(34, 34, 34); font-family: Tahoma, Helvetica, Arial, 宋体, sans-serif; font-size: 14px; line-height: 25.2000007629395px; background-color: rgb(255, 255, 255);">4、锅内留油30cc，放入打散的蛋液炒匀，加入腊鸡腿丁略翻炒。</span><br style="color: rgb(34, 34, 34); font-family: Tahoma, Helvetica, Arial, 宋体, sans-serif; font-size: 14px; line-height: 25.2000007629395px; white-space: normal; background-color: rgb(255, 255, 255);"><span style="color: rgb(34, 34, 34); font-family: Tahoma, Helvetica, Arial, 宋体, sans-serif; font-size: 14px; line-height: 25.2000007629395px; background-color: rgb(255, 255, 255);"><br></span></p><p><span style="color: rgb(34, 34, 34); font-family: Tahoma, Helvetica, Arial, 宋体, sans-serif; font-size: 14px; line-height: 25.2000007629395px; background-color: rgb(255, 255, 255);">5、再放入米饭、青豆、盐、味精、胡椒粉用旺火炒香。</span><br style="color: rgb(34, 34, 34); font-family: Tahoma, Helvetica, Arial, 宋体, sans-serif; font-size: 14px; line-height: 25.2000007629395px; white-space: normal; background-color: rgb(255, 255, 255);"><span style="color: rgb(34, 34, 34); font-family: Tahoma, Helvetica, Arial, 宋体, sans-serif; font-size: 14px; line-height: 25.2000007629395px; background-color: rgb(255, 255, 255);"><br></span></p><p><span style="color: rgb(34, 34, 34); font-family: Tahoma, Helvetica, Arial, 宋体, sans-serif; font-size: 14px; line-height: 25.2000007629395px; background-color: rgb(255, 255, 255);">6、撒上葱花装盘即可。</span><br style="color: rgb(34, 34, 34); font-family: Tahoma, Helvetica, Arial, 宋体, sans-serif; font-size: 14px; line-height: 25.2000007629395px; white-space: normal; background-color: rgb(255, 255, 255);"><span style="color: rgb(34, 34, 34); font-family: Tahoma, Helvetica, Arial, 宋体, sans-serif; font-size: 14px; line-height: 25.2000007629395px; background-color: rgb(255, 255, 255);"><br></span></p><p><span style="color: rgb(34, 34, 34); font-family: Tahoma, Helvetica, Arial, 宋体, sans-serif; font-size: 14px; line-height: 25.2000007629395px; background-color: rgb(255, 255, 255);"><br></span></p><p><span style="color: rgb(34, 34, 34); font-family: Tahoma, Helvetica, Arial, 宋体, sans-serif; font-size: 14px; line-height: 25.2000007629395px; background-color: rgb(255, 255, 255);">POINT</span><br style="color: rgb(34, 34, 34); font-family: Tahoma, Helvetica, Arial, 宋体, sans-serif; font-size: 14px; line-height: 25.2000007629395px; white-space: normal; background-color: rgb(255, 255, 255);"><span style="color: rgb(34, 34, 34); font-family: Tahoma, Helvetica, Arial, 宋体, sans-serif; font-size: 14px; line-height: 25.2000007629395px; background-color: rgb(255, 255, 255);">1、腊鸡腿要带皮炒制才有风味。</span><br style="color: rgb(34, 34, 34); font-family: Tahoma, Helvetica, Arial, 宋体, sans-serif; font-size: 14px; line-height: 25.2000007629395px; white-space: normal; background-color: rgb(255, 255, 255);"><span style="color: rgb(34, 34, 34); font-family: Tahoma, Helvetica, Arial, 宋体, sans-serif; font-size: 14px; line-height: 25.2000007629395px; background-color: rgb(255, 255, 255);">2、腊鸡腿水分含量要足，如不足可采用过油的方法。</span></p><p><br></p>|
13807|嘉嘉牌 喜上喜腊味 一级白油腊肠|http://www.chishenghuo.com/eimages/images/201411/source_img/1269_G_1416259067859.jpg|嘉嘉牌`喜上喜腊味`一级白油腊肠`拌饭`罐头`蛋类`方便`速食`饮料`休闲零食|1|100|方便零食`吃货世界|嘉嘉牌 喜上喜腊味 一级白油腊肠|当前位置: 首页 > 休闲零食 > 方便 速食 饮料 > 拌饭 罐头 蛋类 > 嘉嘉牌 喜上喜腊味 一级白油腊肠|maya-YL-0663|10.49|嘉嘉|340| (已有0人评论)|减少数量 增加数量||na|中华|||<p style="text-align: center"><img src="http://www.chishenghuo.com/eimages/images/image/57061416259356.jpg" style="" title="煲仔饭1.jpg"></p><p style="text-align: center"></p><p style="margin-top: 0px; margin-bottom: 0px; padding: 0px; color: rgb(102, 102, 102); font-family: 微软雅黑, Verdana, 宋体; font-size: 12px; line-height: 18px; white-space: normal; background-color: rgb(255, 255, 255);"><span style="margin: 0px; padding: 0px; font-size: 16px;">腊味煲仔饭</span></p><p style="margin-top: 0px; margin-bottom: 0px; padding: 0px; color: rgb(102, 102, 102); font-family: 微软雅黑, Verdana, 宋体; font-size: 12px; line-height: 18px; white-space: normal; background-color: rgb(255, 255, 255);"><br></p><p style="margin-top: 0px; margin-bottom: 0px; padding: 0px; color: rgb(102, 102, 102); font-family: 微软雅黑, Verdana, 宋体; font-size: 12px; line-height: 18px; white-space: normal; background-color: rgb(255, 255, 255);"><span style="margin: 0px; padding: 0px; font-size: 16px;">有了这煲仔饭，什么菜都不用做了，准保你吃得美美的！<br><br></span></p><p style="margin-top: 0px; margin-bottom: 0px; padding: 0px; color: rgb(102, 102, 102); font-family: 微软雅黑, Verdana, 宋体; font-size: 12px; line-height: 18px; white-space: normal; background-color: rgb(255, 255, 255);"><br></p><p style="margin-top: 0px; margin-bottom: 0px; padding: 0px; color: rgb(102, 102, 102); font-family: 微软雅黑, Verdana, 宋体; font-size: 12px; line-height: 18px; white-space: normal; background-color: rgb(255, 255, 255);"><br></p><p style="margin-top: 0px; margin-bottom: 0px; padding: 0px; color: rgb(102, 102, 102); font-family: 微软雅黑, Verdana, 宋体; font-size: 12px; line-height: 18px; white-space: normal; background-color: rgb(255, 255, 255);"><span style="margin: 0px; padding: 0px; font-size: 16px;">材料<br>大米3人份、腊肠1根、鸡蛋1个、西兰花半颗、姜2片、海鲜酱油3勺、浓缩鸡汁1勺、糖1小勺、芝麻油1勺、色拉油、盐各少许<br><br></span></p><p style="margin-top: 0px; margin-bottom: 0px; padding: 0px; color: rgb(102, 102, 102); font-family: 微软雅黑, Verdana, 宋体; font-size: 12px; line-height: 18px; white-space: normal; background-color: rgb(255, 255, 255);"><br></p><p style="margin-top: 0px; margin-bottom: 0px; padding: 0px; color: rgb(102, 102, 102); font-family: 微软雅黑, Verdana, 宋体; font-size: 12px; line-height: 18px; white-space: normal; background-color: rgb(255, 255, 255);"><span style="margin: 0px; padding: 0px; font-size: 16px;">做法<br><br></span></p><p style="margin-top: 0px; margin-bottom: 0px; padding: 0px; color: rgb(102, 102, 102); font-family: 微软雅黑, Verdana, 宋体; font-size: 12px; line-height: 18px; white-space: normal; background-color: rgb(255, 255, 255);"><span style="margin: 0px; padding: 0px; font-size: 16px;">1、大米洗净用水浸泡1小时，腊肠切薄片，姜切丝，西兰花洗净切小朵。&nbsp;<br><br></span></p><p style="margin-top: 0px; margin-bottom: 0px; padding: 0px; color: rgb(102, 102, 102); font-family: 微软雅黑, Verdana, 宋体; font-size: 12px; line-height: 18px; white-space: normal; background-color: rgb(255, 255, 255);"><span style="margin: 0px; padding: 0px; font-size: 16px;">2、砂锅内层抹薄油，将米放入，加入米量1.5倍的水，用大火烧开后转成最小的火焖。&nbsp;<br><br></span></p><p style="margin-top: 0px; margin-bottom: 0px; padding: 0px; color: rgb(102, 102, 102); font-family: 微软雅黑, Verdana, 宋体; font-size: 12px; line-height: 18px; white-space: normal; background-color: rgb(255, 255, 255);"><span style="margin: 0px; padding: 0px; font-size: 16px;">3、在小碗中加入海鲜酱油、浓缩鸡汁、芝麻油、糖调成料汁。&nbsp;<br><br></span></p><p style="margin-top: 0px; margin-bottom: 0px; padding: 0px; color: rgb(102, 102, 102); font-family: 微软雅黑, Verdana, 宋体; font-size: 12px; line-height: 18px; white-space: normal; background-color: rgb(255, 255, 255);"><span style="margin: 0px; padding: 0px; font-size: 16px;">4、10分钟左右，米饭中的水快收完时，加少许色拉油拌匀。&nbsp;<br><br></span></p><p style="margin-top: 0px; margin-bottom: 0px; padding: 0px; color: rgb(102, 102, 102); font-family: 微软雅黑, Verdana, 宋体; font-size: 12px; line-height: 18px; white-space: normal; background-color: rgb(255, 255, 255);"><span style="margin: 0px; padding: 0px; font-size: 16px;">5、摆入姜丝，姜丝上摆腊肠，中间打入一个鸡蛋。&nbsp;<br><br></span></p><p style="margin-top: 0px; margin-bottom: 0px; padding: 0px; color: rgb(102, 102, 102); font-family: 微软雅黑, Verdana, 宋体; font-size: 12px; line-height: 18px; white-space: normal; background-color: rgb(255, 255, 255);"><span style="margin: 0px; padding: 0px; font-size: 16px;">6、用勺子浇少许料汁在腊肠上，再沿锅边淋少许色拉油，盖上锅盖继续焖5-10分钟（尝一下米熟了就好），关火焖15分钟。&nbsp;<br><br></span></p><p style="margin-top: 0px; margin-bottom: 0px; padding: 0px; color: rgb(102, 102, 102); font-family: 微软雅黑, Verdana, 宋体; font-size: 12px; line-height: 18px; white-space: normal; background-color: rgb(255, 255, 255);"><span style="margin: 0px; padding: 0px; font-size: 16px;">7、煮一锅开水，加少许色拉油及盐，将西兰花烫熟，放入砂锅，趁热淋入料汁，开吃！</span></p><p><br></p>|
